<?xml version="1.0"?>
<xs:schema xmlns:xs="http://www.w3.org/2001/XMLSchema">
    <xs:attribute name="name" type="xs:string"/>
    <xs:element name="shop">
        <xs:complexType>
            <xs:sequence>
                <xs:element ref="category" maxOccurs="unbounded"/>
            </xs:sequence>
        </xs:complexType>
    </xs:element>
    <xs:element name="category">
        <xs:complexType>
            <xs:sequence>
                <xs:element ref="subcategory" maxOccurs="unbounded"/>
            </xs:sequence>
            <xs:attribute ref="name" use="required"/>
        </xs:complexType>
    </xs:element>
    <xs:element name="subcategory">
        <xs:complexType>
            <xs:sequence>

            </xs:sequence>
            <xs:attribute ref="name" use="required"/>
        </xs:complexType>
    </xs:element>


</xs:schema>